Date,Owner,Title,FU Reply
2017-12-11 12:31:00,stealth.mode,"Viral! Siswi SMA Jadi Pelakor, Istrinya Umbar Aib Suaminya",Selingkuh kok diupload bodoh cem nasbung
2017-12-11 12:26:00,jasjus.kriptoss,"Ustadz Abdul Somad Diusir dari Bali, Warga Riau di Bali Marah Besar",Riau sarang nasbung
2017-12-11 12:22:00,president.trump,"Konvoi Pengantar Jenazah Memang Prioritas, tapi Jangan Arogan",Koplak cem nasbung dimari
2017-12-11 11:59:00,setiapmenit,"Demo Kedubes AS, Jawara Aksi Pencak Silat hingga Bakar Foto Trump",Koplak
2017-12-11 09:14:00,gabener212,Presiden PKS: Kami Akan Boikot Produk Amerika Serikat,"ane udh dari dlu boikot produk mamarika kya KFC,PH, McD :ngakaks Lo gak usah ngaskus sekalian tong"
2017-12-11 09:08:00,allohsakmaidik,Duh… Oknum Guru Ngaji di Tulang Bawang Cabuli Anak di Bawah Umur,Cabul boleh asalkan seiman
2017-12-09 11:25:00,wiraprasta333,"Jika Jokowi Tak Bertindak, KAMMI Siap Kepung Kedubes AS di Jakarta",Asik dapet orderan demo lagi
2017-12-09 10:46:00,moderatorccd,"Istri Dihina Artis Porno, Chico Hakim Ciduk Alumni 212 Ini!!",Modaro cok
2017-12-08 14:35:00,metrotvnews.com,Sepanjang 2017 Kekerasan Perempuan di Jakarta Menurun,"Kekerasan terhadap perempuan menurun, tapi intoleransi bertambah. Awas ntar lo modyar bangke lo gak disholatin"
2017-12-07 19:52:00,tukangkomen123,Gubernur Aher Minta Warga Jangan Tolak Imunisasi Difteri,Imunisasi itu haram kata panasbung
2017-12-07 19:46:00,acabindonesia,"""Saya Enggak Setuju Edaran Itu, Di Mana Toleransi Antarwarga?""",Nasbung bodoh
2017-12-07 08:37:00,berlian.co.id,Titiek Soeharto : Emang Nyatanya Enakan Zaman Orde Baru Kan?,Enak gundulmu
2017-12-06 15:03:00,2periode,"Anies Usul Ada Mushala di Halte, Halte Glodok Sudah Ada, Lainnya Menyusul",hanya nastaik kafir yg kelojotan... hahaha... bodoh
2017-12-06 14:57:00,gadis.anal.sex,"Dianggap Tak Sopan, Patung Balet di Surabaya Ditutupi Kain",Panasbung ereksi
2017-12-06 14:43:00,nevertalk,Tangis dan Permohonan Maaf Bos First Travel di Rapat Kreditur,Boleh menipu asalkan seiman Dimaafkan aja
2017-12-05 18:02:00,moderatorccd,"Demi Kaki-5, Anies Tengah Mengkaji Menutup Jalan di Tanah Abang",Kalo perlu jl sudirman buat kaki lima
2017-12-03 18:22:00,incaranwanita,Foto: Penampakan Super Sandi Sedang Olahraga di Minggu Pagi,Iklan justice league ini bego!
2017-11-30 09:32:00,ranttalker,"Cuitan Sandiaga Uno tentang Bondan Winarno Dikritik Warganet, Ada Apa Ya?",Netizen kntl
2017-11-22 07:11:00,soldkeaku,Massa Akan Kembali Gelar Aksi 212!,"Lulusnya kapan, kampusnya dimana, tau2 jadi alumni"
2017-11-17 09:03:00,putra.mahkotak,KPK Dikabarkan Akan Tangkap Wartawan Yang Semobil Bersama Setya Novanto Saat Kecelaka,Tiang listrik paok
2017-11-14 15:58:00,aslan.meaglo,Detik-detik Makan Malam Berujung Penelanjangan Sejoli di Tangerang,Radikal paok
2017-10-14 07:48:00,hasrat.nabi,Minyak goreng dari ulat mahasiswa Malang siap ke Eropa -mengapa ditanya halal-haram?,"dasar mahasiswa buat kegaduhan aja, udahlah gak usah buat yg aneh2 ujung2nya cuma menimbulkan pro dan kontra bagi masyarakat daripada sibuk dgn hal duniawi seperti itu mending ibadah yg rajin, inget akhirat... jgn urusan dunia terus yg dikejar Oh gitu ya"
2017-10-13 09:00:00,soldkeaku,Kasus Jonru Sebentar Lagi Naik ke Tahap Penuntutan!,Kasihan Lo temenin aja di penjara kalo kasihan
2017-10-13 08:36:00,becakmini.v7,"MUI: Kalau Ada yang Bilang Vaksin MR Halal, Itu Bohong!",bodoh tenan
2017-10-10 18:20:00,bowobutoijo,Istri Jonru Diperiksa Polisi,Pake tas LV cok
2017-10-09 08:35:00,arbib,Seribu Lebih Wanita Cantik Menari Gandrung di Pantai Banyuwangi,Kalo kata nasbung ini pengikisan akidah
2017-10-08 16:12:00,kimpet.sekeco,"Prediksi Jokowi Tepat, Bandara Trunojoyo Ramai Peminat",Nasbung biasa jalan kaki
2017-10-08 15:01:00,eggy.sujana,"Lihat Menu Sarapan Prabowo, Warganet Ungkit Hal Menyakitkan, Mulai soal Ditinggal...","https://s.kaskus.id/images/2017/10/08/1248035_20171008011404.jpg Iya duda ""terhormat"" Pas pilpres pura2 rujuk Hbs itu kalah gak jadi rujuk Terhormat gundulmu peyang"
2017-10-06 08:44:00,eggy.sujana,"Elit Banyak Bohongnya, Wajar Prabowo Pilih Bergaul dan Dekat dengan Rakyat",iya ya mungkin anaknya aktif di Lingkungan karang taruna kampung bray? Anaknya wowo kan di paris
2017-10-05 21:22:00,InRealLife,Hoaks Jadi Salah Satu Penyebab Rendahnya Imunisasi MR di Depok,bodoh emang
2017-10-05 20:54:00,putra.mahkotak,Eggi Sudjana Dilaporkan ke Bareskrim Terkait Ujaran Kebencian,Mampus lo
2017-10-05 17:37:00,anti.suap,Polwan cantik yang bertugas di pernikahan kahiyang,bisa gitu ya? anggota polri diatur sama sipil. baru tau ane :travel bodoh. Di situ kan ada pakor polwan Gibran kapasitasnya sebagai pemilik gedung Ya wajar lah koordinasi kan udah mendekati hari H
2017-10-05 12:10:00,karikai04,Jonru Ginting Di Mata Tetangga Dikenal Tertutup dan Pendiam,Mampus lo jon
2017-10-02 17:16:00,moderatorccd,Postingan akun Rijal Ahmad Sediakan Uang 40 Miliar Bagi yang Bisa Habisi Presiden,"lanjutkan ... ga dibayar pun pada mau kok, karena udah pada muak Ntar diciduk nangis lho"
2017-10-02 08:40:00,karikai04,"Amien Rais: Yang Kami Lawan Bukan Jokowi dan Ahok, Tapi...",Sengkuni idola nasbung
2017-10-02 08:37:00,namima,"Jonru Ginting Letih, Pemeriksaan Tambahan Ditangguhkan",Ssssaaayaaa tidak letih
2017-10-02 08:35:00,miextophia,"Terpancing Hoaks, Netizen Komentar Nyinyir terhadap Kapolri",Nasbung bodoh
2017-10-02 08:28:00,nyakbertutur,Ini Penjelasan Hebohnya Miss Grand International Malaysia Soal Kuda Lumping,Kalo nasbung di sini demen budaya onta
2017-09-29 10:19:00,kencingin.pohon,Polisi Tahan Jonru Ginting,Modaro cok
2017-09-29 10:15:00,muhammad..tohir,Delapan Hal yang Tak Boleh Dilakukan Perempuan Arab Saudi,tapi efeknya pemerkosaan jadi menurun dan tidak kriminal kepada wanita juga gak ada ini penting semoga diindonesia bisa menerapkan yang sama jangan cuma mikirkan dunia tapi juga akherat Gundulmu peyang cuk
2017-09-28 08:29:00,stealth.mode,5000 Personel Brimob Diterjunkan untuk Amankan Demo 299 Besok,"5rb brimob, 5rb senjata ilegal!! Bahaya ini!! Mak lo ilegal"
2017-09-25 12:11:00,atandi,Polisi Tangkap Pemilik Situs Nikahsirri.com Aris Wahyudi,Gw yakin byk org2 sumbu pedek pada daftar di sini
2017-09-20 10:17:00,stealth.mode,Inilah Empat Model Kemitraan 212 Mart,Koplak mart
2017-09-20 10:16:00,nubi.genit,Serunya Mbah Jokowi Main Pedang-pedangan dan Mandikan Cucu,"Mudah""an om wowo bisa cepet punya cucu biar merasakan kebahagiaan kayak pakde wiwi :) Tapi anaknya homo"
2017-09-19 09:18:00,kafir.as.leader,Ketua DPRD Lebong Jambi Menampar Dokter di Rumah Sakit,Dari partai apa?
2017-09-19 09:11:00,ferina.,"Prabowo: Bukan Tak Solider ke Rohingya, Rakyat Kita Masih Susah",Mbulet wae. Asu tenan
2017-09-17 19:47:00,wahyu715,"Disinggung Jadi Menteri, AHY: Jabatan Penting Tapi Bukan Segalanya",No FU Reply
2017-09-17 10:12:00,mahkotax.maneh,"Girang ajak cucu ke mal, Jokowi bilang saya kan juga manusia biasa ",Kasihan capres yg anaknya fashion designer homo
2017-09-14 17:20:00,rhaimukui,Fahira Idris: Asma Dewi Tak Mungkin Punya Uang Rp 75 Juta,Anak mantan menteri yg munafik
2017-09-14 09:34:00,beyoungcarerock,Indra Piliang Ditangkap di Tempat Karaoke Taman Sari Terkait Narkoba,Pujaan nasbung nih
2017-09-13 17:31:00,DomCobbTotem,"Soal Foto Asma Dewi-Prabowo, Fadli: Jokowi Saja dengan Dimas Kanjeng",jleb juga jawaban si zonk :o Mbahmu jleb
2017-09-13 14:49:00,kafir.as.leader,Kasihan Baru Saja Wisuda. Ini Fakta Dodik Ikhwanto yang Ngefans Dian Sastro,"Lu bisa bedain mana yg mengkritik, mana yg menyindir dan mana yg menghina secara berlebihan ga sih? Barbuk.. https://s.kaskus.id/images/2017/09/13/347794_201709130230370482.jpg Lu nganggepnya ini mengkritik dan menyindir? Kalo iya.. kita kopdar.. ntar kita sama2 ke rumah ortu lu.. nyokap lu g"
2017-09-13 14:37:00,kelazcorro,"Kasus Penghinaan Iriana Jokowi, Pelaku Mengaku Tidak Suka Pemerintah",jadi dikekang gini yah. kebebasan pers sudah dibatasi Ngatain orang pramuria itu kebebasan pers ya? bodoh lo
2017-09-13 14:29:00,kelazcorro,"Kasus Penghinaan Iriana Jokowi, Pelaku Mengaku Tidak Suka Pemerintah","seremm, pemerintah skrg sensitip bgt, selidiki dan langsung cidukk aj. Kalo gak bodoh juga gak bakalan diciduk bodoh lo"
2017-09-12 21:27:00,dr.solusi,Polisi Amankan Atribut HTI di Rumah Penghina Iriana Jokowi,Satu dua orang yang menghina pemerintah ditangkap sih ga masalah Yang jadi masalah kalau jumlah penghina pemerintah ini sudah masuk jumlah yang banyak ((massal)) Daripada nangkepin banyak orang apa ga lebih bijak pemerintahnya aja yang tau diri dan mundur dengan terhormat Ngefans andi arief?
2017-09-05 18:41:00,loveluv,Politikus Gerindra Tersangka Pembakar 7 SD Terancam Dipecat,Tujuan nya apa bakar sekolah?
2017-09-05 18:38:00,beyoungcarerock,"Copot Razman, Jonru Ginting Tunjuk LBH Bang Japar Jadi Pengacara",Bang japar punyanya fahira idris bangke emang tuh kambing betina
2017-09-05 11:34:00,DomCobbTotem,"Kapolri: Catat yang Besar, Kasus Saracen akan Dikembangkan!",MCA dibantai juga pak
2017-08-30 09:29:00,siput.berlari,Cara Santai Gibran Rakabuming Hadapi Hoaks,mau saingan sama eike ya? :mad https://s.kaskus.id/images/2017/08/30/7941333_201708300925440622.jpg Duduk gitu gak kecepit tuh konti nya?
2017-08-29 18:07:00,iosh.44,"Gagal Pergi Umrah, 164 Korban Azizi Travel Datangi Mapolres Aceh Barat",HOAX Di aceh gak ada penipu Secara provinsi barokah gitu lho
2017-08-22 17:02:00,rifkyfo,Mahfud MD pun Pernah Jadi Korban First Travel,"aduh :cd “Dan barangsiapa yang menutupi (aib) seorang muslim sewaktu di dunia, maka Allah akan menutup (aibnya) di dunia dan akhirat” (Hadits Riwayat Imam at-Tirmidzi). Kita hidup di dunia ini terkadang merasa lebih mulia daripada orang lain. Hanya gara-gara satu kesalahan yang diperbuat oran..."
2017-08-22 16:57:00,natasyalim,First Travel kantongi Rp 848.700.100.000 duit jemaah yang belum diberangkatkan,lu ingat bray ! dalam semua kasus apapun ..... harus ada yg bertanggung jawab dong :gila: Kasus apapun?
2017-08-22 16:44:00,natasyalim,First Travel kantongi Rp 848.700.100.000 duit jemaah yang belum diberangkatkan,pemerintah gak mau bertanggung jawab untuk ganti rugi ...... lalu siapa yg bertanggung jawab dong ? masa minta sama tuhan yg harus bayar ganti rugi umat itu ? :bingungs :takut:cd Oh jadi yg salah pemerintah ya?
2017-08-18 06:48:00,kelazcorro,"First Travel Dikelola Mirip Kerajaan, Tilap Uang Jemaah Rp 715 Miliar",Mau 550m kek mau 715m kek Pokoknya negara harus hadir mengganti semua kerugian umat Trus pelakunya gak perlu ganti rugi?
2017-08-09 16:33:00,jongos.widodo,"Alasan Najwa Shihab Keluar dari Metro TV, Betulkah Karena SARA?",Katanya gara2 doi mau nikah ? :bingung Jawaban paling bodoh di thread ini
2017-08-08 14:54:00,xutux06,The Yudhoyono Institute Bukan Alat Politik AHY,Institute kebo
2017-08-04 22:51:00,Gursel,BERBAGI CINTA UNTUK SODARA (KASKUS REGIONAL SOLO PEDULI),Siap gan
2017-07-26 16:09:00,namima,Puan Maharani Dinilai Cocok Jadi Cawapres,Mbahmu cawapres
2017-07-26 16:05:00,berita.indo,AKSI POLITIS DI BALIK AKSI 287,bodoh cok
2017-07-26 15:20:00,tribunnews.com,Gadis Ini Blak-blakan Ceritakan Pengalaman Pahitnya Jadi Budak Seks Tentara ISIS,Panasbung isis
2017-07-24 18:50:00,dara999,"Kasus Proyek Jalan, Politikus PKS Yudi Widiana Ditahan KPK",Korupsi boleh asalkan seiman
2017-06-30 14:22:00,presiden.trump,Ketum FPI sebut Habib Rizieq sehat dan tenang berada di Yaman,"Visa ""Unlimited"" nya udah Abis... Jangan bukak Aib Visa orang napa... :marah :batabig https://s.kaskus.id/images/2016/04/14/3048228_20160414091656.gifhttps://s.kaskus.id/images/2016/04/14/3048228_20160414091656.gif Visa unlimited tapi bisa habis? Serasa makan all you can eat tapi dib"
2017-06-26 08:39:00,presiden.trump,"Dari Yaman, Habib Rizieq Ucapkan Selamat Idul Fitri 1438 H","Ga salah ane mengidolakan habib yg satu ini,lihat tuh negara2 timteng begitu menghormati dan menerima kehadiran beliau, Ya udah lo nyusul aja sono"
2017-06-25 05:17:00,aghilfath,"Lewat Facebook, Prabowo Ucapkan Selamat Idul Fitri 1438 H",Selamat berkumpul dgn anak cucu pak prabowo
2017-06-23 19:55:00,mr.irvano,"SAH, INFO A1 : Polri Pastikan Hary Tanoe Tersangka !",Pengacaranya si hotman. Lolos kayaknya. Toh kasusnya juga geje :D Gundulmu geje
2017-06-23 15:20:00,fulbright,"Luhut: Nanti Pemerintah Yang Disalahin, Padahal Elu Yang Ngebut",Biasanya panasbung miskiner yg mudik pake motor
2017-06-23 15:18:00,petrux99,"Kader PD Pasang Foto Agus Yudhoyono di Bus-bus Pemudik, untuk Apa?",La emangnya kenapa..terserah yg masang lah...wong ya uang uang mrk sendiri... Apa cuma ahok doang yg potonya boleh dipasang?? bodoh lo
2017-06-23 15:14:00,gembaladomba13,Suara Pembaca / Laporan Forum BP Raya,"Mod, kalo bisa thread (isi nama) masuk islam di sticky semua aja biar kaskus makin blangsak"
2017-06-23 15:11:00,heavenisnomore,"Panglima TNI Salat Berjamaah Bermandikan Hujan, Ulama Menangis Haru",Masuk angin ntar
2017-06-23 10:01:00,thudd,"Jackie Chan Masuk Islam , Ganti Nama Menjadi ""Zakaria Chan""",apanya yg nipu :gila: Penipu bodoh
2017-06-21 14:24:00,gastor,"Sopir Taksi ""Online"": Saya Sudah Teriak-teriak, Pak Jangan Masuk",cuma ada di rejim mr jokes Ini ada manusia tolol ikut ngaskus
2017-06-21 11:23:00,frances19,Jokowi Ulang Tahun Jadi Trending Topic No.1 Di Indonesia.,#kamibersamaHRS dong trending world wide
2017-06-19 15:43:00,aaabbbccczzz201,Kapolda Metro: Saya Angkat Topi kalau Rizieq Penuhi Panggilan Polisi,Jangan byk berharap Bibib pilih sembunyi
2017-06-19 15:37:00,soldkeaku,"Pertemukan Puan dan SBY, CT Ajak Semua Pihak untuk Bersatu",rejim ini penuh dengan kebencian Kaum lo itu yg penuh kebencian
2017-06-19 15:35:00,acabindonesia,Panglima TNI: Jangan ikuti ulama bersorban tapi pecah belah NKRI,Penistaan ulama nih si gatot
2017-06-19 15:32:00,kimpet.sekeco,Ridwan Kamil: Hasil Survei Sebut 7 Juta Penduduk Jabar Tolak Pancasila,"Ingat jabar, ingat nasbung bodoh"
2017-06-19 15:30:00,doeltetappaten,"Eks Staf Panglima: Kemarin Musuh Bersama Kita Ahok, Sekarang Jokowi",Sumber bodoh
2017-06-19 15:23:00,blizzard000,PAN Desak KPK Minta Maaf ke Amien Rais,Bodo amat lah
2017-06-19 15:08:00,jebta123,General Manager PT WOM FINANCE menganiaya karyawannya,Kantor riba urusannya neraka Lo sendiri aja yg ke neraka
2017-06-19 11:30:00,PutraKucink,"Uang “THR” tak Sesuai Keinginan, Sejumlah Preman Buat Onar dan Ancam Pengunjung Cafe","Ada istilah lu makan, berak, kencing, nyari duit disini, apa salahnya lu berbagi sama warga sini..ya intinya saling ngehormatin aja lah, kalo emang dirasa ga cocok monggo angkat kaki, jangan dibikin repot dan heboh pake cara cara menjelekkan begini :shakehand2 Berbagi sama preman?"
2017-06-18 13:43:00,PutraKucink,"Geram, Dirut PLN Minta Penyebar Isu Naiknya Tarif Listrik 450 VA Ditangkap",Rezim Senggol Ciduk:wkwkwk Kalo meresahkan harus segera diciduk lah bodoh
2017-06-18 09:19:00,merdeka.boy,Ini proyek fiktif pembangunan hotel yang dijanjikan Yusuf Mansyur,Investasi bodong boleh asalkan seiman
2017-06-16 21:53:00,karikai04,"Aduannya Dicueki Menkopolhukam, Alumni 212: Suara Umat Enggak Dianggap",Modaro ae cuk
2017-06-16 19:27:00,karikai04,"Rangkul Kelompok Islam, Panglima TNI Sedang Bersiap Tantang Jokowi di Pilpres 2019",Ini orang tiap hari dipromosiin sama MCA
2017-06-16 19:26:00,si.tamfan,"Habib Rizieq: Saya ke Tanah Suci Bukan Lari, Tapi Perlawanan",Melawan dengan cara kabur
2017-06-16 19:01:00,frances19,Pesan Rizieq Ke Jokowi : Berdamai Atau Ada Revolusi Di RI.,Ajakan makar
2017-06-16 10:48:00,karikai04,Pengacara Investor Heran Mengapa Ustaz Yusuf Mansyur Bisa Kebal Hukum,Ini ulama palsu tukang tipu
2017-06-16 09:52:00,miakoda,"Asgardia, Negara Antariksa Pertama, akan Segera Dibangun",No FU Reply
2017-06-15 19:14:00,mtx98,Rizieq Tak Bisa Pulang karena Cuma Punya Tiket Pesawat Qatar,"Kasian setiap hari nastaik berfantasi coli menghayal tentang habib rizieq tapi ternyata beliau baik baik aja, sehat wal afiat, bahagia disana, silahkan nunggu sampe gila nastaik :D Modaro wae cok"
2017-06-15 18:07:00,mouse.slimy2,Bahaya Tren Vaksin Diganti dengan Cara Arab,Kalo panasbung pasti pilih cara arab
2017-06-15 15:44:00,frances19,"Era Jokowi, Sri Mulyani Incar Facebook Dan Twitter Untuk Bayar Pajak.",Terima kasih sby & prabowo
2017-06-15 15:36:00,seputarahy,"Tatap Pilkada 2018, SBY dan AHY Tour de Java Naik Kereta",Kemana mana sama papi mami
2017-06-14 16:59:00,namimii,Saat Habib Rizieq Bertemu Zakir Naik di Arab Saudi,"Aseli berlinang air mata gue bro baca berita ini, terharu, dua orang pilihan Allah, imam besar, guru besar, musuh utama para kafir dan komunis serta zionis, ulama besar islam bertemu, subhanallah.. Berikanlah habib rizieq shihab dan dr.zakir naik senantiasa kesehatan, umur yang panjang, dan limpa..."
2017-06-13 21:22:00,namimii,Saat Ridwan Kamil Peluk Erat Anaknya yang Lulus Masuk ITB...,"Panasbung: * Astaghfirullah, anak Pak Ridwan Kamil tak Pakai Gamis * Miris, Ridwan Kamil Lebih Memilih Universitas Dibanding Pesantren * Ridwan Kamil Memilihkan Jurusan Teknis Ketimbang Agama * Ridwan Kamil Menguliahkan Anaknya di Kampus Sekuler Sabar gan, panasbung emang bodoh semua"
2017-06-13 21:05:00,katakanlah.news,Firza Husein Bersalawat Usai Diperiksa Jadi Saksi Rizieq,Semoga kasus ini tidak berlanjut ke pengadilan Karena seyogyanya sebagai bangsa yg beradab wajib membela kehormatan seorang ulamanya yg juga merupakan guru sekaligus pemimpin Semoga di bulan penuh ampunan ini bangsa ini sudi membukakan pintu maaf bagi imam besar nya sendiri Ulama cabul tong?
2017-06-13 19:55:00,bruceywucey,Ini Syarat Rumah Tangga yang Berhak Dapat Subsidi Listrik,"puas banget tuh pendukung jokowi sekarang apa-apa serba mahal heran ya janji kampanye pas sekarang bisa beda semua emank sih pembangun jalan banyak tapi bisa rakyat makan semen sama pasir mikir pak tahu sih bapak orangnya gak bisa mikir Makanya kerja, jangan ikutan demo melulu bodoh"
2017-06-13 17:25:00,duomiloser,"Hujat Ibu Hamil Karena Diberikan Kursi Prioritas KRL, Status Wanita Ini Viral","Ya hak dia lah mau ngasih apa engga, netizen alay sotoy mah gavm usah dianggep cuekin aja, buang energi nanggepin keybord warrior doang.. lagian udah tau hamil bukannya diem diem dirumah, lakinya ga mampu nafkahin ampe harus kerja juga padahal lagi hamil?? Bacot lo"
2017-06-13 12:36:00,frances19,Buni Yani Minta Masyarakat Indonesia Mendukungnya Disidang.,Minta dukungan fpi aja cuk
2017-06-13 12:34:00,telfs,Sejumlah Pondok Pesantren di NTB Terindikasi Sebarkan Paham Radikal,Jabar Ntb Sumbar Sarang panasbung otak kopong
2017-06-12 19:40:00,justinbibib,"Sisi Lain Rizieq Shihab, Sang Cucu Nabi Muhammad SAW",cuma disini keturunan nabi mau dikriminalisasikan Ini contoh manusia tolol
2017-06-09 18:33:00,nevertalk,Alumni 212 Sebut Aksi Bela Ulama Lebih Penting dari Tadarus,"bodoh nih cepirit 212, tadarusan dibilang gak penting"
2017-06-09 18:13:00,sheraiah,Aksi Bela Ulama 96 Hanya Diikuti 150 Orang,Katanya 7 juta
2017-06-09 16:52:00,mbakmomon,"Dilarang Pengelola Istiqlal Gelar Aksi Bela Ulama, Tuding Rezim Penguasa Intervensi","MAKSUD ENTE APA? Ini sudah jelas kriminalisasi ulama masih aja ngeyel. Coba agan buka mata buka hati, ingat sesalah-salahnya ulama adalah sebenar-benarnya kita!! Ini yg ngomong bukan ane loh, USTADZ YM!! :shakehand Umat aja semua bersatu kok saat 212, kenapa sekarang enggak? TUNJUKKAN PADA DUNI"
2017-06-09 16:26:00,saya.a1,Aksi Bela Ulama juga Bahas Penyambutan Habib Rizieq,Cepirit 212
2017-06-09 16:14:00,demen.mamahmuda,Koordinator Berharap Aksi Bela Ulama Diikuti 500 Ribu Orang,Katanya 7 juta
2017-06-09 15:46:00,badutmalam,"Dikira Mau Ditangkap Paspampres, Tukang Becak Ini Dapat Bantuan Dari Jokowi","Ya.. inilah kelas Jokowi, senterklas! :) Ini pasti fansnya rijik"
2017-06-09 15:38:00,miexology,Alumni 212 Berharap Diberi Ruang di Masjid Istiqlal,Makan tuh 7jt
2017-06-09 14:28:00,namimi,"Konon Ada Aksi Bela Ulama, Tapi di Istiqlal Tampak Biasa",Hahaha sukurin
2017-06-09 14:26:00,cukur.rambu,Kapolda Metro Jaya: Apakah Oknum Ulama Bersalah Tak Dihukum? Tidak Boleh Dong,Maju trus pak
2017-06-09 14:22:00,impassion,Penyidik Polda Metro Dilaporkan ke Propam karena Mengancam Habib Rizieq,"Siapapun bro, catat SIAPAPUN mengancam, mengintinidasi, memfitnah, mengkriminalisasi ulama kami, guru kami, imam besar kami, maka bersiaplah menghadapi kami para mujahid tentara allah yang siap berjihad wakafkan jiwa raga..!! https://s.kaskus.id/images/2017/06/09/9691256_20170609015617.jpg Bacot lo"
2017-06-09 14:17:00,segokarak,"Ada Tausiah Di Istiqlal, Aksi Bela Ulama 96 Digelar Di Luar Masjid",Udah dilarang msh ngeyel
2017-06-09 14:08:00,aghilfath,"Alumni 212 gelar tarawih on the street, ini reaksi Kapolda Metro",lu yang cabul setan lo..!! Kalo belum terbukti sama aja fitnah..!! Ya udah kalo gak cabul suruh pulang aja guru lo. Berani kagak? bodoh lo
2017-06-09 09:30:00,andrikfk,Isuzu MU-X 4x4 Siap Meluncur di Agustus,Ga ada apa2 nya lah dibandingin G63 AMG 6X6.. Cah pekok
2017-06-08 12:09:00,aghilfath,Jokowi copot nama Din Syamsuddin dari daftar dewan pengarah UKP-PIP,Sukurin lo
2017-06-08 11:57:00,aghilfath,Kebutuhan Hidup Rizieq Shihab di Arab Saudi Ditanggung Sukarelawan,Macam gembel aja
2017-06-07 16:00:00,trasidele,Awas Berita HOAX: Presiden Erdogan Desak PBB Lindungi Habib Rizieq dan Ulama di ...,"jelas2 yang bikin hoax itu panastak yang ingin mengadu donba erdogan dengan habib rizieq. ga akan bisa. habib rizieq itu guru spiritualnya erdogan dan raja salman, mana mempan trik bodoh gini untuk mengadu domba mereka. Ini sarkasme atau beneran bodoh ya?"
2017-06-07 15:45:00,katakanlah.news,"Firza dan Rizieq, Pengacara: Masa Murid Kurang Ajar Sama Guru","Klo ada apa2 emang masalahnya dimana? Wong lainan jenis kelamin kok. Nastaik homo tuh permasalahin, penghancur peradapan, klo laki sama laki kimpoi punya anak bentuk nya taik bukan manusia :D:D Kan bukan muhrim Dasar bodoh"
2017-06-07 11:14:00,nihilistic,Habib Rizieq Ajukan Long Stay Visa ke Arab Saudi,Katanya mau pulang tgl 12 Katanya mau pulang kalo jokowi lengser Sekarang mau long stay
2017-05-27 19:55:00,pepayamengkel36,Sweping FPI di depok dibubarkan polisi,"Lucu aja, menegakkan amar maruf nahi munkar malah dilarang, harus nunggu korban dari gangster motor lagi emangnya..!! Kont0l lo"
2017-04-17 19:53:00,ahmad.jufrie,Santri Ciamis Kembali Long Macrh Tamasya Al Maidah,bodoh bgt
2017-04-02 09:35:00,aghilfath,Skybridge Stasiun Balapan Solo-Terminal Ditarget Rampung Bulan Ini,Hasil kerja walikota kafirrrrrrr
2017-03-10 23:02:00,mtx98,"Bandung Kebanjiran Lagi, Aher: Bukan Berarti Kami Tak Bekerja",Bajir gpp yg penting seiman
2017-03-09 15:23:00,seamono,SBY: Insya Allah Saya Akan Ambil Bagian dari Pemerintahan Ini,Bodo amat lah
2017-03-03 22:17:00,KASKUS.Editor,[Success Stories] Berawal Dari KASKUS Hingga Dimodali Anak Presiden Jokowi,AHY presidenku Habib rizieq wakil presidenku
2017-03-03 15:07:00,kibrottaawa,Raja Arab Saudi ternyata Suka Dengan Moto Tiga Kata Jokowi Ini,"Kalo ""jakarta untuk rakyat"" suka gak tuh king salman?"
2017-02-17 21:13:00,aghilfath,"Dikebut Setelah Mangkrak 20 Tahun, Tol Becakayu Siap Operasi Akhir 2017",Terima kasih sby & ahy
2017-02-10 22:01:00,kaskus.infoforum,"Tongkrongin Live Debat Menuju DKI 1, Sebelum Nyoblos Nanti Gan!",agus-silvy juaranya:ultahhore Iye iye terserah lo
2017-02-04 16:57:00,kakemapisang,Firza Husein Habiskan Waktu di Tahanan dengan Zikir dan Baca Quran,"Klo berbicara dengan orang pinggiran sih gak masalah pake bahasa kasar seperti pisang, dll itu. Tapi yang sedang kita bahas disini adalah neng firza yang merupakan salah seorang wanita yang patut kita hormati. Masakan ente bisa menuduh dia seolah-olah dia sampah yang suka pisang!? Ini sarkas"
2017-01-16 14:59:00,foga,3 Program Unggulan Dari 3 Cagub DKI Jakarta,Ane lebih setuju program agus sylvi karena jelas... Kebetulan ane juga butuh uang untuk modal usaha. Ini contoh manusia tolol
2016-11-22 08:37:00,InRealLife,Cerita Pengacara Buni Yani Foto Bareng Jokowi di PIM,Itu kan suaminya fahira idris (gentong)
2016-11-13 13:43:00,xcqtor,Boni Hargen ungkap dana aksi demo 411 berasal dari hasil korupsi SBY,emg sby terlibat hambalang ya? Iya bodoh
2016-11-08 11:13:00,bacot.kuda,"Ahmad Dhani Dituduh Menista Jokowi, Ini 3 Pembelaannya",Ya ampun ini org nempel terus sama si valak
2016-10-02 18:00:00,super..pekok,Solo A - Z,I. Iki Ini Iki gudeg mbak yus Iki mie ayam
2016-10-02 08:59:00,xibaotai,Artis di Balik Video Mesum Papan Iklan Blok M,"Ni balasan buat pemimpin bermulut kotor, berhati kotor menindas rakyat kecil membela pengembang, pro asing cukong, ga berani ikut tax amnesty.. bayangin kalo anak kecil melihat video itu, siapa yang bertanggung jawab atas semua ini??saatnya jakarta berubah.. Masih mau pemimpin kotor?? Ini pendukung"
2016-09-30 20:35:00,stratovarius666,"Sungai di Jakarta Kini Bersih, Anies: Itu Dirancang oleh Pak Fauzi Bowo",menteri pecatan
2016-09-30 20:10:00,aga377,"Tax Amnesty Periode I Sukses, Pengusaha Gelar Tumpengan",panasbung ikutan gak?
2016-09-30 20:09:00,sonsevenine,Mahasiswa Madiun Tolak Kedatangan Presiden Jokowi,cuma ber4?
2016-09-18 22:32:00,adoeka,"Fahri sebut Irman pengusaha kaya, dijebak uang receh Rp 100 juta",TS tolol
2016-09-07 18:41:00,heavenisnomore.,"Lepas Kontingen PON Jabar, Aher Teteskan Air Mata",Bodo amat
2016-08-10 11:31:00,rakyatmedan,"Gila akh, Penjualan Premium akan Dihentikan, gimana nasip kami",Lo jalan kaki aja tong
2016-08-05 09:00:00,jackal15,"Yang Tadinya Berambisi Jadi Cagub Justru ""Hilang"" Saat Tahapan Pilkada Dimulai",Kumpulan manusia2 tolol
2016-08-03 08:24:00,teman.kapok,Golkar akhirnya pilih Ahok ketimbang Yusril,ah masa :travel Sono lo maen twitter aja sama followers2 dungu lo
2016-08-02 12:26:00,kaskursi,Yusril Tokoh yang Paling Tak Direkomendasikan Jadi Gubernur DKI,biasanya yg ga diunggulkan malah menang Delusi akut
2016-07-30 19:53:00,RocketBull,"Tak Lama Lagi, Jantung Babi Bisa Ditransplantasikan Pada Manusia",Habis transplan auto-murtad
2016-07-30 19:29:00,visuapalooza,Warga Jarah Minuman Kemasan Yang Diangkut Truk Terguling di Pekalongan,Mental panasbung
2016-07-30 12:23:00,jibrut212,Gerindra: Sandiaga Uno Ada di Garis Depan Lawan Ahok di Pilgub,Om ucril kiper aja
